,Flair,Subreddit,Domain,Likes,Dislikes,Title
210,Coronavirus,r/india,m.hindustantimes.com,12,0,"Punjab, after Odisha, becomes 2nd state to extend lockdown till April 30"
211,Coronavirus,r/india,nature.com,14,0,People power: How India is attempting to slow the coronavirus
212,Non-Political,r/india,thequint.com,2,0,"The National Commission for Women (NCW) launched a WhatsApp number on Friday, 10 April, to report cases of domestic violence, which have seen a rise during the coronavirus lockdown period."
213,Coronavirus,r/india,self.india,18,0,Questions on my mind because of the lockdown and the pandemic that’s still at large.
214,Coronavirus,r/india,frontline.thehindu.com,34,0,"Test not, find not"
215,Coronavirus,r/india,youtu.be,17,0,Call to all makers - How YOU can contribute to India's fight against COVID-19!
216,Non-Political,r/india,youtube.com,0,0,Google vs Facebook | Rap Battle | Hindi | (Abusive)
217,Policy/Economy,r/india,marginalrevolution.com,8,0,Pandemic Policy in Developing Countries: Recommendations for India - Marginal REVOLUTION
218,Coronavirus,r/india,selfbiohacks.com,2,0,Coronavirus hotspots in Delhi | Containment zones in Delhi
219,Coronavirus,r/india,gulfnews.com,16,0,"Coronavirus: India offers support to UAE, Gulf nations in battle against pandemic"
220,AskIndia,r/india,self.india,3,0,What is the best western country for desi immigrants?
221,Coronavirus,r/india,timesofindia.indiatimes.com,6,0,Man who edited special branch letter arrested in Vadodara | Ahmedabad News - Times of India
222,Coronavirus,r/india,ndtv.com,2,0,Here's What You Can Expect In Air Travel After The Lockdown Ends
223,Coronavirus,r/india,twitter.com,12,0,Kerala Police: “Corona war .. we shall overcome” (hilarious video)
224,Coronavirus,r/india,theprint.in,26,0,IIM study predicts 1.5 lakh Covid-19 cases by May first week as ‘result of Tablighi event’
225,Politics,r/india,self.india,22,0,I built this tweet generator app for left-wing & right-wing Indian twitter (URL: http://botbaby.in/)
226,Non-Political,r/india,thewire.in,16,0,The New Pregnancy Termination Bill Still Ignores Women's Agency Completely
227,AskIndia,r/india,self.india,7,0,"How should we solve the stray dogs, monkey problem in India"
228,Coronavirus,r/india,thehindu.com,7,0,Coronavirus | ICMR study points to community transmission
229,Non-Political,r/india,theprint.in,16,0,Masala tikka-flavoured snacks to AK-47s: What 5 slain Lashkar terrorists brought from Pakistan
230,Non-Political,r/india,v.redd.it,3271,0,Woke up to this today. Made my day!
231,Politics,r/india,financialexpress.com,6,0,‘Parallel governance’: Shiv Sena objects to Governor holding meeting with officials on coronavirus
232,Coronavirus,r/india,m.telegraphindia.com,29,0,Coronavirus pandemic: Sex test ban suspended
233,Coronavirus,r/india,m.economictimes.com,271,0,India receives 1.7 lakh PPEs donated by China
234,Coronavirus,r/india,self.india,15,0,Is the coronavirus enough to change the academic year?
235,Non-Political,r/india,self.india,19,0,Prafulla Chandra Ray - The father of chemical science in India
236,Coronavirus,r/india,theprint.in,724,0,"RSS says Tablighi Jamaat conduct not reflection on all Muslims, they’re aiding govt in fight"
237,Policy/Economy,r/india,theprint.in,14,0,Asian Development Bank assures India of 2.2 billion dollars in Covid-19 response aid
238,Coronavirus,r/india,thequint.com,932,0,Bhopal Doctor Lives In Car To Protect Family From COVID-19
239,Coronavirus,r/india,self.india,17,0,Covid-19: Respiratory illness patients without travel or contact history test positive in ICMR study
240,Non-Political,r/india,self.india,8,0,Blood donations needed
241,AskIndia,r/india,i.redd.it,42,0,Can somebody identify this text written into the landscape near Shipting india? Measures aprox. 200 x 60 feet.
242,Coronavirus,r/india,arre.co.in,198,0,"India’s Shocking Lockdown Reality: 92,000 Calls of Child Abuse in 11 Days"
243,Non-Political,r/india,self.india,13,0,Public Appeal for Help [COVID19]
244,Politics,r/india,article-14.com,44,0,It Took A Village To Rescue This Woman From Detention
245,Coronavirus,r/india,m-timesofindia-com.cdn.ampproject.org,3,0,"Food, shelter or surveillance, LSGD gets job done"
246,Coronavirus,r/india,forbes.com,6,0,India’s Drugmakers Ramp Up Production Of ‘Game-Changer’ Coronavirus Drug Hydroxychloroquine
247,Coronavirus,r/india,outlookindia.com,510,0,Doctor Who Treated Slum Dwellers Dies From Coronavirus In Indore
248,Non-Political,r/india,filmcompanion.in,23,0,"Masakali 2.0: AR Rahman Is Understandably Annoyed, But Remakes Aren’t Going Away Anytime Soon | Film Companion"
249,Non-Political,r/india,ndtv.com,335,0,"""Can't Let Anyone Murder Shaktimaan As Ekta Kapoor Murdered Mahabharat"": Mukesh Khanna"
250,Business/Finance,r/india,self.india,3,0,A perspective about business that will help you in investment
251,Coronavirus,r/india,self.india,25,0,Delhi hospital in dock for not following COVID-19 protocol
252,Coronavirus,r/india,bbc.co.uk,20,0,Clothing makers in Asia give stark coronavirus warning
253,AskIndia,r/india,self.india,4,0,What is the state of online deliveries - I need to order a few items?
254,Coronavirus,r/india,twitter.com,8,0,"In Punjab,27 cases are there with no travel history, yes it can be said that most of them are cases of community transmission: Chief Minister Captain Amarinder Singh"
255,Coronavirus,r/india,deccanherald.com,127,0,Actual coronavirus cases at least four times the reported count: Kiran Mazumdar-Shaw | Deccan Herald
256,Coronavirus,r/india,twitter.com,13,0,Goa govt has begun integrating Allopathy and Ayurveda to treat COVID19 patients: Chief minister Pramod Sawant
257,Coronavirus,r/india,thenewsminute.com,859,0,"'We will die': Andhra doc who alleged shortage of masks, PPE in viral video suspended"
258,Coronavirus,r/india,thenewsminute.com,11,0,"India expands COVID-19 strategy, to test persons with influenza-like illness in hotspots"
259,Non-Political,r/india,youtube.com,0,0,India Today Conclave: Q&A With Salman Rushdie
260,Coronavirus,r/india,self.india,5,0,[Opinion] Governance and Administration participation culture must for better Electorates.
261,Unverified,r/india,self.india,20,0,"Tata companies told to conserve cash, go slow on capex"
262,Scheduled,r/india,self.india,22,0,"Random Daily Discussion Thread - April 10, 2020 at 09:15AM"
263,Coronavirus,r/india,self.india,19,0,Whom should i Donate to for helping with Coronavirus?
264,Coronavirus,r/india,self.india,0,0,COVID-19 Tracker
265,Non-Political,r/india,youtube.com,9,0,A poisoned legacy – the Bhopal disaster | DW Documentary
266,AskIndia,r/india,self.india,8,0,What is Indian 10th and 12th education equivalent in US?
267,AskIndia,r/india,self.india,5,0,SHOULD I BUY A USED LUXURY CAR IN INDIA
268,AskIndia,r/india,self.india,638,0,Why does the government come with a begging bowl during every crisis?
269,Politics,r/india,open.spotify.com,8,0,An interesting podcast exploring the history of BJP and Narendra Modi
270,Politics,r/india,twitter.com,8,0,Kannan Gopinathan on Twitter
271,Coronavirus,r/india,timesofindia.indiatimes.com,82,0,COVID-19: Viswanathan Anand to play online chess to raise funds
272,Coronavirus,r/india,self.india,278,0,"I have a feeling that, just like Kerala, rest of India will flatten the curve at around 10,000 cases because we’ll never test community spreading cases at all."
273,Coronavirus,r/india,self.india,4,0,Will India move to bartering based economy?
274,AskIndia,r/india,self.india,7,0,Need advice on double post graduation in computer science field
275,Non-Political,r/india,youtu.be,0,0,Daniyal Asad- Sayyian (Official Audio) #iTunes #Spotify #Amazon
276,Non-Political,r/india,timesofindia.indiatimes.com,32,0,"Mom rides 1,400km on scooty to get son home"
277,AskIndia,r/india,self.india,11,0,What is the standard news source in India?
278,Coronavirus,r/india,indianexpress.com,29,0,Coronavirus: Pooled testing planned in zero-case districts to get the real picture
279,Coronavirus,r/india,economictimes.com,84,0,Bhopal and Indore turn into Covid hotspots as new MP government struggles
280,Non-Political,r/india,self.india,140,0,[MISC] Do any young Indians even watch this obnoxious sit-com crap?
281,Coronavirus,r/india,theprint.in,3,0,Understand the method in Covid-19’s madness. India doesn’t need complete lockdown
282,Coronavirus,r/india,thewire.in,92,0,Why the ‘Gujarat Model of Development’ Has Seen the Highest COVID-19 Fatality Rate
283,Non-Political,r/india,deccanherald.com,121,0,"Youth beaten up, female doctors attacked in Delhi on pretext of coronavirus"
284,Politics,r/india,thehindu.com,27,0,Coronavirus | Centre concerned over polarisation on religious lines
285,AskIndia,r/india,self.india,10,0,Getting international payment to bank account
286,Coronavirus,r/india,m.youtube.com,0,0,Song about Lockdown. SATHE THAKAR GAAN | ScreenShout! | ScreenShout Originals
287,Coronavirus,r/india,businesstoday.in,385,0,"Indian Railways converts 375 coaches to isolation wards daily; 40,000 beds ready"
288,AskIndia,r/india,self.india,0,0,When will KEAM 2020 (Kerala Engineering Exam) be held?
289,Coronavirus,r/india,indianexpress.com,160,0,Man commits suicide as he missed wife in lockdown
290,Non-Political,r/india,i.redd.it,95,0,TV Vaccine is the only hope!
291,AskIndia,r/india,self.india,41,0,Parents who just had babies/about to have babies during this crisis- how to manage for essentials and baby supplies?
292,Coronavirus,r/india,indianexpress.com,159,0,Doordarshan highest-watched channel in India during week ended Apr 3: BARC
293,Coronavirus,r/india,independent.co.uk,29,0,"Coronavirus: India makes face masks mandatory for more than 300m people, punishable by up to six months in prison | The Independent"
294,Coronavirus,r/india,moneycontrol.com,65,0,Actual number of COVID-19 positive cases at least four times the reported count: Kiran Mazumdar-Shaw
295,Coronavirus,r/india,thenewsminute.com,62,0,How empathy instead of hate helped south states trace Jamaat attendees
296,Politics,r/india,freepressjournal.in,4,0,"Rangoli Chandel loses calm after Twitter warning over hate comments, calls it 'anti-national'"
297,Non-Political,r/india,thequint.com,194,0,"Hyderabad Store Refuses Two Manipuri Men Entry, Manager Detained"
298,Non-Political,r/india,youtube.com,17,0,"'Corona Car' Becomes A Traffic Stopper In Hyderabad, Aims To Spread COVID-19 Awareness"
299,Non-Political,r/india,thehansindia.com,9,0,Electricity consumers in Telangana to be charged based on past bills for April
300,Policy/Economy,r/india,self.india,5,0,Covid 19 - Parliamentary Standing Committee on Science & Technology invites inputs
301,AskIndia,r/india,self.india,192,0,"Paypal Update : A Kind Redditor paid for my course, for Free !"
302,Coronavirus,r/india,economictimes.indiatimes.com,147,0,Delhi seals 20 coronavirus hotspots with immediate effect
303,Politics,r/india,thenewsminute.com,28,0,How empathy instead of hate helped south states trace Jamaat attendees
304,Coronavirus,r/india,i.redd.it,106,0,ICMR will now check for community transmission more broadly by testing anyone suffering from Influenza-like illness in COVID-19 hotspots
305,Coronavirus,r/india,i.redd.it,311,0,Surveillance drone in my red-zone
306,Non-Political,r/india,self.india,74,0,[RANT] A list of people I want to say FU to but can't
307,Coronavirus,r/india,self.india,0,0,No basis yet to blame Tablighi: Scientists
308,Coronavirus,r/india,indiatoday.in,259,0,Telangana man ties masks on his goats after tiger tests coronavirus positive at New York's Bronx Zoo
309,Food,r/india,self.india,82,0,What to do if some shopkeepers in my area are selling products at prices above MRP in this pandemic?
310,Coronavirus,r/india,self.india,20,0,Tool to automate finding Big Basket Slot in this Covid season
311,AskIndia,r/india,self.india,26,0,Have you ever watched Pakistani daily soaps?
312,AskIndia,r/india,self.india,15,0,Found lice in my room. Help
313,Policy/Economy,r/india,theprint.in,154,0,India lost more jobs due to coronavirus lockdown than US did during Depression
314,Coronavirus,r/india,pib.gov.in,33,0,"Order placed for 1.7 crore PPE and 49,000 ventilators"
315,Coronavirus,r/india,thewire.in,48,0,Kerala Govt Running 65% of Shelter Camps for Migrants After Lockdown: Centre to SC
316,Policy/Economy,r/india,thequint.com,12,0,PM Modi Needs Political Courage to Fix Post-Lockdown Economy
317,Non-Political,r/india,imgur.com,0,0,Please do the needful
318,AskIndia,r/india,self.india,144,0,"Urgent, please help"
319,Science/Technology,r/india,youtube.com,0,0,Only Legends Understand This || Funny Memes || Silent Memes
320,Politics,r/india,self.india,5,0,"Could anyone who might know more about Indira Gandhi kindly tell me some of the facts that I should be aware of, as an Indian (and a concerned citizen of the world) about the person/politician/prime-minister she was. I know she is a divisive figure so am hoping for an enlightened discussion. Thanks."
321,Policy/Economy,r/india,thehindu.com,2,0,A time for extraordinary action - An unprecedented scale of state investment is required to lift up the Indian economy
322,Coronavirus,r/india,self.india,55,0,Why are softdrinks essential products when it causes comparable damage as cigarettes and alcohol?
323,Politics,r/india,timesnownews.com,86,0,"Politics in the time of corona: WB CM questions Centre's choice for 'yellow' PPE kits, says 'might not use it'"
324,Policy/Economy,r/india,bloombergquint.com,106,0,"India Unemployment Rate Spiked To 23% Post Lockdown, Says CMIE"
325,Coronavirus,r/india,thehindu.com,24,0,Coronavirus | ICMR study points to community transmission
326,AskIndia,r/india,self.india,3,0,Is this story of Mahabharata true or not?
327,Non-Political,r/india,self.india,25,0,"[OC] So boredom of lock down has made me a poet. Here I present to you my latest attempt to paint the picture of pain and suffering of a young kid in a slum who is fighting the lock down. Your criticism is welcome, here goes nothing."
328,Coronavirus,r/india,theprint.in,13,0,2 Safdarjung Hospital doctors assaulted by man for ‘spreading’ Covid-19
329,Coronavirus,r/india,timesofindia.indiatimes.com,28,0,"Need to gradually lift lockdown, have unconventional exit strategy: Dr Devi Shetty | India News - Times of India"
330,Coronavirus,r/india,economictimes.indiatimes.com,71,0,"India may have to sell itself out of this crisis, says Rajiv Bajaj"
331,Non-Political,r/india,self.india,38,0,Scared..
332,Science/Technology,r/india,youtu.be,9,0,A poisoned legacy – the Bhopal disaster | DW Documentary
333,Coronavirus,r/india,livemint.com,77,0,No need to panic over availability of PPE: Health ministry
334,Non-Political,r/india,i.redd.it,47,0,"Shab-E-Baraat Mubarak to everyone, please refrain from going outside and complete all your prayers while staying in your house. Pray for the protection of everyone from this deadly illness. Also pray for the speedy recovery of people who have been affected by this."
335,Non-Political,r/india,ibtimes.co.in,111,0,Coronavirus layoffs: Indian H-1B visa holders leave US in 60 days
336,Coronavirus,r/india,livemint.com,382,0,Virus infection curve flattens in Kerala as fewer cases crop up
337,Coronavirus,r/india,ndtv.com,180,0,"Coronavirus: Odisha Extends COVID-19 Lockdown Till April 30, Schools Shut Till June 17"
338,Photography,r/india,v.redd.it,340,0,The moment of twilight in Hyderabad. (Shot last year)
339,Politics,r/india,i.redd.it,2368,0,Waiting for such an address by the PM...
340,Coronavirus,r/india,timesofindia.indiatimes.com,33,0,"India, Russia decide to cooperate with each other to deal with coronavirus pandemic"
341,AskIndia,r/india,self.india,27,0,I recharged on Airtel for 379 Rs pack and I didn't get unlimited talk-time as mentioned in pack. No customer care executives are available to pick calls or reply to e-mails. Help!
342,Coronavirus,r/india,theguardian.com,13,0,India's leaders have panicked. Now the millions who power the country are suffering | The Guardian
343,Non-Political,r/india,youtube.com,1,0,"Indian Festival in Kampar (Aadi Pooram), 3 Aug 2019"
344,Coronavirus,r/india,indianexpress.com,60,0,Woman donates all her savings to PM CARES Fund
345,Scheduled,r/india,self.india,29,0,Late Night Random Discussion Thread !
346,Non-Political,r/india,self.india,32,0,Jobless Kashmiri
347,Business/Finance,r/india,ccnews24.net,17,0,Largest Cryptocurrency exchange in India has a daily volume increase of more than 470%
348,Coronavirus,r/india,thenewsminute.com,187,0,"1,300 km to home: Tamil Nadu migrant workers walk, hitchhike from Maharashtra in lockdown"
349,AskIndia,r/india,self.india,11,0,How do I strengthen my mind?
350,Coronavirus,r/india,thehindu.com,90,0,Man assaults two women doctors in Hauz Khas market for 'spreading' coronavirus
351,Coronavirus,r/india,livemint.com,105,0,India’s corona curve steeper than Asian peers even as trajectory dips slightly
352,Coronavirus,r/india,thequint.com,89,0,‘Not Worried’: Specially-Abled Man Volunteers for COVID-19 Trial
353,Coronavirus,r/india,m.timesofindia.com,24,0,Coronavirus outbreak: Gurugram declares nine areas as containment zones | Gurgaon News - Times of India
354,AskIndia,r/india,self.india,13,0,"So, What if most people get educated and started having standards?"
355,Coronavirus,r/india,self.india,46,0,This disease is showing us who the real parasites are in this country
356,Coronavirus,r/india,ndtv.com,35,0,Kerala Awaiting Drug Controller's Nod For COVID-19 Plasma Therapy
357,Coronavirus,r/india,indiatoday.in,21,0,Disinfectant tunnel installed in Noida
358,Politics,r/india,thenewsminute.com,55,0,Video: Karnataka panchayat bans and ostracises Muslims over COVID-19 stigma
359,Non-Political,r/india,self.india,15,0,Calling all the app developers to help fight depression
360,Coronavirus,r/india,indiatimes.com,6,0,What Is 'Bhilwara Model' And How It Can Be A Template For COVID-19 Hotspots Across India
361,Coronavirus,r/india,labroots.com,28,0,Does 99-Year Old BCG Vaccine Really Defend from COVID-19?
362,Coronavirus,r/india,hindustantimes.com,34,0,10 Madhya Pradesh policemen contracted coronavirus from Jamaat men: IG
363,Coronavirus,r/india,self.india,20,0,"Any online or retail store in Mumbai- bandra east that is delivering essentials such as groceries, vegetables etc?"
364,Coronavirus,r/india,economictimes.indiatimes.com,6,0,Kerala to start clinical trial of plasma therapy for COVID-19 treatment
365,Coronavirus,r/india,theprint.in,4,0,"Covid an excuse to push Indian Muslims out of informal sector jobs. Apartheid the next step | What Muslims are effectively facing now is a new form of concerted, deliberate economic marginalisation through blatant lies linking the community to the virus"
366,,r/india,i.imgur.com,0,0,Can you guess this
367,Coronavirus,r/india,timesofindia.indiatimes.com,37,0,Maharashtra cabinet mulls complete shutdown in certain areas
368,Policy/Economy,r/india,thewire.in,83,0,25% Retailers May Be Out of Business After Lockdown: Retailers Association of India
369,Non-Political,r/india,i.redd.it,70,0,Curb your comedy
370,AskIndia,r/india,self.india,13,0,What are some of the best / unbiased sources of online news in India?
371,Non-Political,r/india,livemint.com,82,0,Ola launches 'Ola Emergency' service for hospital visits in Bangalore
372,Coronavirus,r/india,bbc.com,12,0,How India’s railways are joining the fight against COVID-19
373,Politics,r/india,theprint.in,66,0,Covid an excuse to push Indian Muslims out of informal sector jobs. Apartheid the next step
374,Policy/Economy,r/india,economictimes.indiatimes.com,67,0,About 400 million workers in the informal sector in India may sink into poverty: UN report
375,Coronavirus,r/india,self.india,176,0,List of Large Hindu Gatherings AFTER Tablighi Jamaat Incident.
376,Non-Political,r/india,self.india,17,0,Why do we believe in God?
377,Coronavirus,r/india,self.india,11,0,a Telegram bot for covid19india.org - Access COVID-19 stats for India within Telegram itself
378,Coronavirus,r/india,thehindu.com,39,0,Clerical error led to release of COVID-19 patient in Villupuram
379,Coronavirus,r/india,theprint.in,105,0,Delhi govt makes wearing masks compulsory for people stepping outdoors
380,Politics,r/india,theprint.in,37,0,"Karnataka govt panel says no medical reason to continue lockdown, seeks phased withdrawal"
381,AskIndia,r/india,self.india,20,0,So what are the superstitions or beliefs that your family has been following in these times of Coronavirus?
382,AskIndia,r/india,i.imgur.com,15,0,"Okay, suddenly my WhatsApp turned into Saffron. What’s going on?"
383,Science/Technology,r/india,self.india,102,0,PSA: All labels are now available in Spotify India
384,Politics,r/india,twitter.com,114,0,UP Police Fact Check with Altnews
385,AskIndia,r/india,self.india,19,0,Any filmmakers on this subreddit?
386,AskIndia,r/india,self.india,42,0,"What are some Indian YouTube channels that made you go, ""Damn, I can watch this all day and learn a lot as well""? X-post askreddit"
387,Coronavirus,r/india,indianexpress.com,45,0,Man lynched in Delhi on suspicion of conspiracy to spread COVID-19
388,Business/Finance,r/india,newsd.in,4,0,COVID-19 impact: Gurugram unit of U.S.-based firm sacks employees without assigning reason
389,Coronavirus,r/india,twitter.com,65,0,"The Resident Doctors’ Association at AIIMS Bhopal has written a letter to the Director of the institute regarding ""abusive behaviour and physical assault by policemen on resident on-duty doctors""."
390,AskIndia,r/india,self.india,2,0,What are the temples doing to help the situation in India
391,Coronavirus,r/india,aljazeera.com,74,0,How Tablighi Jamaat event became India's worst coronavirus vector
392,AskIndia,r/india,self.india,11,0,Guidelines for Importing Covid 19 test kits and masks
393,Coronavirus,r/india,ibtimes.co.in,884,0,"800 people attend shradh ceremony in MP; 12 test positive for coronavirus, 800 others quarantined"
394,Coronavirus,r/india,ndtv.com,142,0,"Coronavirus India: Lockdown Likely To Be Extended, PM Modi Suggests At All-Party Meeting"
395,AskIndia,r/india,self.india,9,0,How is everyone enjoying the clean air? What can be done to keep it clean in the future?
396,Coronavirus,r/india,timesofindia.indiatimes.com,15,0,Nizamuddin dargah: Tablighi Jamaat chief traced to Delhi's Zakir Nagar residence | Delhi News - Times of India
397,Politics,r/india,aljazeera.com,15,0,India: Fears of coronavirus outbreak in Assam's detention centres
398,Coronavirus,r/india,self.india,8,0,Coronavirus | Masks- To Wear or Not To Wear
399,Coronavirus,r/india,mobile.twitter.com,14,0,"84 persons out of the 96 persons who tested positive for #COVID19 today are from ""single source"" event(delhi); 763 cases out of the total 834 cases in the state are from ""single source"" event: Beela Rajesh, Tamil Nadu Health Secretary"
400,AskIndia,r/india,self.india,14,0,Are we living way too frugally
401,Coronavirus,r/india,youtu.be,0,0,Positive impact of covid 19
402,Politics,r/india,thewire.in,112,0,'Corona Crossword': Dainik Bhaskar Attempts to Communalise COVID-19 Pandemic
403,Coronavirus,r/india,theprint.in,57,0,IIM study predicts 1.5 lakh Covid-19 cases by May first week as ‘result of Tablighi event
404,Coronavirus,r/india,livemint.com,63,0,"No community transmission in India yet, says WHO regional head"
405,Coronavirus,r/india,scroll.in,45,0,"Coronavirus: 10 policemen in Bhopal got infection from Tablighi Jamaat members, says senior officer"
406,Photography,r/india,i.imgur.com,1450,0,"Zoom in! I took over 600 shots of last night's Supermoon and stacked them together to get more details on the lunar surface. Comparison of 1 exposure vs 600 exposures, taken from Bhopal[Nikon D3100, 2764x1368][OC]"
407,Coronavirus,r/india,wap.business-standard.com,49,0,"PM hints at lockdown extension, says situation like 'social emergency'"
408,Coronavirus,r/india,ndtv.com,14,0,"Coronavirus Testing Strategy Revised In India, Ambit Widened"
409,AskIndia,r/india,self.india,19,0,Quarantined for 5 months
410,AskIndia,r/india,self.india,6,0,Amazon Pay or Capital Float Moratorium
411,Politics,r/india,economictimes.indiatimes.com,3,0,"COVID-19: SC asks Centre, J&K to reply on plea for restoration of 4G services"
412,Photography,r/india,i.redd.it,32,0,"""Artsy Business"" [1816x1188] Shot on Fujifilm Proplus ISO 200 35mm film using Canon EOS 300 film camera."
413,Non-Political,r/india,self.india,17,0,Need curfew travel pass to travel from Noida to Delhi
414,Policy/Economy,r/india,self.india,21,0,SC issues notice in FMP's petition seeking restoration of 4G internet in J&K during COVID-19 crisis
415,Coronavirus,r/india,in.mobile.reuters.com,6,0,Donations pour in but India's 'PM CARES' coronavirus fund faces criticism
416,Coronavirus,r/india,self.india,13,0,Where can I find actual COVID19 test numbers in india?
417,AskIndia,r/india,self.india,8,0,What therapy is officially prescribed for GID along with severe depression?
418,Coronavirus,r/india,indianexpress.com,29,0,"Mumbai: Two more city hospitals shut: Bhatia hospital, Hinduja in Khar"
419,Politics,r/india,reuters.com,21,0,Donations pour in but India's 'PM CARES' coronavirus fund faces criticism
420,Coronavirus,r/india,newsonair.com,32,0,First installment of relief package to 20 crore women Jan Dhan account holders released
421,Coronavirus,r/india,business-standard.com,32,0,Around 400 mn Indians can slip deeper into poverty due to Covid-19: ILO
422,Coronavirus,r/india,jacobinmag.com,8,0,India Could Be on the Brink of a Coronavirus Catastrophe — and Modi Will Be to Blame
423,AskIndia,r/india,self.india,11,0,Looking for freelance content writers
424,Coronavirus,r/india,self.india,42,0,Fight against stupidity
