,Flair,Subreddit,Domain,Likes,Dislikes,Title
425,Coronavirus,r/india,indianexpress.com,40,0,"From Ground Zero: Tested in hospitals, they died hours later | At the state's Ground Zero in Mumbai, where over 10,000 tests have been done so far, Indian Express tracked the final days of four patients from Andheri to Mumbra, who shuttled from one hospital to another, desperately seeking answers."
426,Non-Political,r/india,self.india,12,0,Covid-19 Recession Grapevine. Share what is going on in your companies
427,Politics,r/india,indianexpress.com,61,0,Maharashtra minister Deshmukh questions MHA and Doval over Tablighi meet in Delhi
428,Policy/Economy,r/india,livemint.com,83,0,Goldman Sachs has the bleakest forecast for Indian economy
429,Coronavirus,r/india,taiwannews.com.tw,6,0,Why the world is hungry for a drug made in India
430,AskIndia,r/india,self.india,5,0,What is the ringtone that playes on pradhanji's phone?
431,Politics,r/india,thewire.in,36,0,Tablighi Jamaat Members Did Not Defecate in Open After Being Refused Non-Veg Food
432,Coronavirus,r/india,indianexpress.com,26,0,"A lockdown requires a command, an opening will require confidence"
433,AskIndia,r/india,self.india,19,0,Can we actually report someone for spreading fake news in whatsapp ?
434,Policy/Economy,r/india,indianexpress.com,26,0,Excess stocks of the Food Corporation of India must be released to the poor --Jean Dreze writes: Releasing food is all the more crucial as the emergency cash transfers proposed by the finance minister are likely to have severe limitations.
435,Policy/Economy,r/india,reuters.com,57,0,"As delivery workers emerge as frontline soldiers, India's government warms to e-commerce"
436,Non-Political,r/india,self.india,6,0,The Story Of Ancient India: Forces Allied Against Indian History & Story Of Deep South | Raj Vedam
437,Policy/Economy,r/india,thequint.com,16,0,India’s GDP May Fall to 4.8% for FY21 Due to COVID-19: UN Report
438,Policy/Economy,r/india,ft.com,21,0,Arundhati Roy: ‘The pandemic is a portal’ | Free to read
439,AskIndia,r/india,self.india,2,0,First time on Tinder
440,Coronavirus,r/india,thenewsminute.com,4,0,"Chennai family is using Lego to bond, and spread awareness on coronavirus"
441,Coronavirus,r/india,business-standard.com,3,0,"Coronavirus India: Govt exempts customs duty on ventilators, testing kits"
442,Politics,r/india,timesofindia.indiatimes.com,9,0,Pakistan aiming to score narrow political goals by seeking Covid-19 initiatives under SAARC: Govt sources
443,Coronavirus,r/india,self.india,12,0,Here's how we can speed up COVID-19 testing in India.
444,Coronavirus,r/india,hindustantimes.com,25,0,Tablighi Jamaat leader Maulana Saad Kandhalvi traced: Report
445,Policy/Economy,r/india,self.india,385,0,"To people who are demanding the ban on export of medicines from India to other nations , have you given any thoughts to what will happen if other nations ban the export of things we need ( ventilators , PPE , masks , advanced medicines )"
446,Politics,r/india,i.redd.it,618,0,Let me tell you why...
447,Politics,r/india,theprint.in,561,0,China’s blunders in Wuhan should settle the debate about democracy and economic progress: The virus exploded from Wuhan to the world because the Chinese form of government abhors transparency. What they need is democracy — and India should learn this lesson.
448,AskIndia,r/india,self.india,6,0,Need help remembering a kitchenware advertisement jingle!
449,Non-Political,r/india,self.india,13,0,"Lawyers of India, what is your take on pre nup agreements?"
450,Coronavirus,r/india,timesofindia.indiatimes.com,29,0,"Falling prices, transport woes force farmers to dump their vegetables"
451,Non-Political,r/india,youtu.be,11,0,#IndiaCares
452,Coronavirus,r/india,self.india,9,0,Indian Doctors on Corona ( Zoom Video Conferencing)
453,Coronavirus,r/india,thehindu.com,6,0,"Needed, greater decentralisation of power: Even as States have taken up positions of leadership in the pandemic response, federal limitations are becoming hurdles"
454,Coronavirus,r/india,i.redd.it,0,0,Everything was going daijobu until this event happened.
455,Coronavirus,r/india,livewire.thewire.in,10,0,Khidmat-e-Khalq: Young Volunteers Team Up to Help Those in Need
456,Coronavirus,r/india,self.india,15,0,Do you think India should utilize this lock down to promote a cleaner India ?
457,AskIndia,r/india,self.india,11,0,What happen to locust
458,Photography,r/india,v.redd.it,14,0,"Its a little refreshing this morning, thanks to Unexpected Rain. Corona is cutrently under control, hope it stays that way."
459,Politics,r/india,thehindu.com,17,0,"Needed, greater decentralisation of power"
460,Non-Political,r/india,deccanherald.com,22,0,When the 1918 Spanish flu reached Bengaluru
461,Coronavirus,r/india,ndtv.com,3,0,"""Operation SHIELD"" In Delhi To Tackle Coronavirus, Says Arvind Kejriwal"
462,AskIndia,r/india,self.india,15,0,What happens when Swiggy/Zomato order is cancelled because no delivery partner was able to deliver?
463,Politics,r/india,freepressjournal.in,695,0,Muslim man who claimed his pregnant wife was turned away by Rajasthan hospital now says he lied
464,Scheduled,r/india,self.india,22,0,"Random Daily Discussion Thread - April 09, 2020 at 09:15AM"
465,AskIndia,r/india,self.india,8,0,Filtered whole house air exchanger : DIY?
466,Policy/Economy,r/india,thethirdpole.net,13,0,"Cut down poplars in Kashmir to check Covid-19 spread, orders government"
467,Coronavirus,r/india,indiatimes.com,145,0,Huge Setback: 50 Who Attended Tablighi Jamaat From Maharashtra Untraceable; Govt Warns Them
468,Politics,r/india,m.huffingtonpost.in,274,0,US Is Suddenly Okay With Indian Hydroxychloroquine Maker It Banned For Multiple Violations
469,Non-Political,r/india,scroll.in,32,0,The other virus: Hate crimes against India’s Muslims are spreading with Covid-19
470,Non-Political,r/india,youtu.be,16,0,The moment Amrutanjan Bridge was demolished.
471,Coronavirus,r/india,mumbaimirror.indiatimes.com,14,0,"Mumbai: No new admissions at Breach Candy after nurse, technician test positive | 93 staffers including doctors, nurses and technicians will be tested."
472,AskIndia,r/india,self.india,16,0,Does anyone face this issue with Jio? My speed for particular apps is dismal
473,Coronavirus,r/india,thehindu.com,184,0,"Coronavirus lockdown | Govt. helpline receives 92,000 calls on child abuse and violence in 11 days"
474,Coronavirus,r/india,timesofindia.indiatimes.com,35,0,"Amid coronavirus outbreak, 15 monkey deaths create alarm in UP | India News - Times of India"
475,Coronavirus,r/india,livemint.com,252,0,Coronavirus: Mumbai becomes first city in India to make face masks compulsory in public
476,Coronavirus,r/india,m.timesofindia.com,9,0,Two Tablighi men booked for misbehaviour
477,Coronavirus,r/india,livelaw.in,206,0,SC Directs Private Laboratories To Conduct COVID-19 Test Free Of Cost
478,AskIndia,r/india,self.india,6,0,Why are the Covid19 tests not free?
479,Politics,r/india,deccanherald.com,181,0,"Migrant woman in Bihar coronavirus isolation ward sexually abused, dies | Deccan Herald"
480,Coronavirus,r/india,timesofindia.indiatimes.com,153,0,Help poor if you want to honour me: PM on 'stand up for Modi campaign'
481,Business/Finance,r/india,self.india,72,0,"Finance Basics – Share Market,Mutual fund, Insurance"
482,Business/Finance,r/india,self.india,6,0,Is this a good deal?
483,Politics,r/india,thehindu.com,8,0,Violence over PM’s lights-out call
484,Coronavirus,r/india,twitter.com,311,0,PM Modi: Lifting Coronavirus lockdown does not seem possible
485,AskIndia,r/india,self.india,10,0,Any Podcast ?
486,Coronavirus,r/india,altnews.in,115,0,Morphed newspaper clipping claims Tablighi Jamaat's Maulana Saad donated Rs 1 crore to PM CARES fund - Alt News
487,Politics,r/india,self.india,9,0,[Serious] How do you create political awareness?
488,AskIndia,r/india,self.india,14,0,CS career question: Leaving lesser known company in 4 months of joining for Amazon
489,Coronavirus,r/india,bloombergquint.com,13,0,"Coronavirus Update: Total Covid-19 Cases In India At 5,274, Death Toll At 149"
490,,r/india,newslaundry.com,89,0,Kannada media paints the coronavirus crisis communal
491,Policy/Economy,r/india,moneycontrol.com,161,0,India's GDP may plummet to a multi-decade low of 1.6% in FY21: Goldman Sachs
492,Non-Political,r/india,indiagoneviral.com,0,0,A Communal Virus and Our Collective Irrationality
493,Politics,r/india,theprint.in,200,0,"Mumbai man cycling to J&K home gets a lift in truck, CRPF airlifts ailing father to hospital"
494,Politics,r/india,theprint.in,222,0,Kejriwal and Khattar forgot Vadra deals. Only IAS Ashok Khemka stuck to fighting corruption
495,AskIndia,r/india,self.india,3,0,Is it impossible to get Admission into HARVARD BUSINESS SCHOOL for MBA if you are from tier-3 engineering college in india?
496,Coronavirus,r/india,i.redd.it,189,0,"Wearing Masks compulsory in Mumbai, or get arrested under section 188 of IPC (48 OF 1860)"
497,AskIndia,r/india,self.india,60,0,What can I do?
498,Non-Political,r/india,self.india,51,0,Shaktimaan S01E16 - Hindi is our national language
