,Flair,Subreddit,Domain,Likes,Dislikes,Title
0,Coronavirus,r/india,self.india,210,0,Coronavirus (Covid-19) Multi-Lingual Resources Wiki
1,Food,r/india,i.redd.it,356,0,First Mango 🥭 in our home
2,Non-Political,r/india,i.redd.it,5770,0,Found my autograph diary while going through some of my old stuff. Here is Dr Kalam's autograph I took 16 years ago.
3,CAA-NRC-NPR,r/india,i.redd.it,896,0,Marriott Ahmedabad trying to spread smiles amidst lockdown
4,Coronavirus,r/india,news18.com,160,0,"Flouting Lockdown Rules, Hundreds Served Biryani at Karnataka BJP MLA's Birthday Bash in Tumkuru"
5,Coronavirus,r/india,ndtv.com,107,0,Karnataka BJP MLA Throws Mega Birthday Bash Amid COVID-19 Lockdown
6,Coronavirus,r/india,indiatoday.in,126,0,Coronavirus crisis: Akshay Kumar donates Rs 3 crore to Mumbai's municipal corporation for PPE
7,Non-Political,r/india,ndtv.com,90,0,IMF Inducts Raghuram Rajan To Key Advisory Panel
8,Coronavirus,r/india,news18.com,111,0,"Unable to Sell Produce Due to Lockdown, Farmer Commits Suicide in Karnataka"
9,Coronavirus,r/india,ndtv.com,106,0,10-Month-Old Girl Dies At COVID-19 Quarantine Centre In UP
10,Politics,r/india,theprint.in,84,0,"Modi had trapped himself in a corner, then coronavirus arrived to save the day for him"
11,,r/india,i.redd.it,555,0,Zee News Apologises for running fake news
12,Coronavirus,r/india,twitter.com,56,0,"Flouting the countrywide lockdown, several people had gathered at a mosque in Bengal's Murshidabad district for Friday prayers today. Police rushed to the spot and cleared the area."
13,Coronavirus,r/india,mobile.twitter.com,80,0,Shipments of serological test kits have not arrived in India yet. At least 5 deadlines have been missed. We have no option but to do RT PCR tests in clusters instead of rapid testing: ICMR Sources.
14,Politics,r/india,youtube.com,106,0,How Bollywood Normalised Rape Culture | BuzzFeed India
15,Non-Political,r/india,i.redd.it,435,0,"Karnataka CM Feeds Stray Cat, Urges All To Put Out Food & Water For Animals Amid Lockdown"
16,Policy/Economy,r/india,ndtv.com,37,0,"""Straightforward Yes"": Raghuram Rajan On Return To India If Asked To Help"
17,Non-Political,r/india,i.redd.it,38,0,"Germany 1933 :Jews are not welcomed, India 2020......"
18,Non-Political,r/india,timesnownews.com,43,0,"Gujarat horror: 13-year-old boy physically assaults, rapes 11 year old minor girl"
19,Policy/Economy,r/india,deccanherald.com,43,0,"Ah, now the govt needs NGOs, does it?"
20,Coronavirus,r/india,i.imgur.com,25,0,Gas Cylinder delivered from agency left in Sunlight after cleaned by Dettol water to avoid Corona.
21,Coronavirus,r/india,self.india,27,0,"Please, help maids and wage workers"
22,Coronavirus,r/india,ndtv.com,31,0,Migrants Seeking To Go Home Amid Lockdown Set Vehicles On Fire In Gujarat
23,Politics,r/india,indiatoday.in,620,0,AIIMS Resident Doctors' Association rejects mandatory donation of 1-day salary to PM-CARES fund
24,Non-Political,r/india,twitter.com,57,0,Indian Army destroys terror launch pad used by terrorists killed in Keran ops
25,Coronavirus,r/india,thenewsminute.com,26,0,"From COVID-19 ward, 26-yr-old patient in TN writes 4 exams, completes course term. By April 6, when she was discharged, Laasya managed to complete her final exams and the second term of the course she is studying in another country."
26,Coronavirus,r/india,vice.com,99,0,India’s Hindu Nationalists Are Inciting Hate By Claiming Muslims Are Spreading Coronavirus
27,Coronavirus,r/india,scroll.in,33,0,Coronavirus: Rajasthan extends lockdown till April 30; global toll crosses 1 lakh-mark
28,Coronavirus,r/india,english.mathrubhumi.com,35,0,Kerala tops among primary health centres in India
29,Coronavirus,r/india,indianexpress.com,21,0,Foodgrain supply to Gujarat doubled during lockdown: FCI
30,AskIndia,r/india,self.india,22,0,Help wanted - Just found out my wife is pregnant for the first time!
31,Coronavirus,r/india,ndtv.com,35,0,PM Likely To Address Nation To Announce Whether Lockdown Ends Tuesday
32,Coronavirus,r/india,self.india,23,0,People who test negative might also have coronavirus: Study
33,Coronavirus,r/india,news18.com,22,0,"After 2 doctors and staff, three cancer patients at Delhi Govt Hospital test Covid-19 positive. Earlier this week, a doctor and nine para-medical staff had also tested positive for the COVID-19 at the Delhi government-run hospital."
34,Coronavirus,r/india,thewire.in,176,0,"No Studies to Link COVID-19 to Pollen But Kashmir Government Wants 42,000 Poplars Axed"
35,Politics,r/india,hindustantimes.com,19,0,YS Jagan Mohan Reddy's government removes state election commissioner through ordinance
36,Non-Political,r/india,telegraphindia.com,153,0,"Panchayat on Amazon Prime is a winner, riding high on humour and heart"
37,Coronavirus,r/india,washingtonpost.com,136,0,"Aggressive testing, contact tracing, cooked meals: How the Indian state of Kerala flattened its coronavirus curve"
38,,r/india,self.india,16,0,Bihar lady carries baby in arms.
39,,r/india,ndtv.com,12,0,"2 Dead, 4 Missing After Ash Leak From Reliance Power Plant In Madhya Pradesh"
40,Coronavirus,r/india,newslaundry.com,266,0,"No food, no cash, money in banks 40 km away: Rural Maharashtra’s women say they are waiting for death"
41,Coronavirus,r/india,i.redd.it,555,0,OXFORD COVID-19 GOVERNMENT RESPONSE TRACKER.(Source in comment)
42,Politics,r/india,self.india,12,0,It seems all is not well between Modi and Shah.
43,Coronavirus,r/india,indiatoday.in,10,0,"In 13 states, NGOs fed more people than govt did during lockdown"
44,Non-Political,r/india,i.redd.it,11,0,Fallen Heroes!
45,Coronavirus,r/india,bloomberg.com,13,0,Villagers Turn Away Relatives as Virus Scare Grips Rural India
46,Food,r/india,bangaloremirror.indiatimes.com,10,0,"Restaurant-owners feed 10,000+ people every day"
47,Non-Political,r/india,upload.wikimedia.org,548,0,"Bhutanatha temple complex at Badami, Karnataka, Built in 7th century."
48,Coronavirus,r/india,thewire.in,71,0,Punjab: Muslims Families Hide in Riverbed After Being Driven From Hoshiarpur Villages
49,Coronavirus,r/india,scroll.in,83,0,Amit Malviya’s fake news fountain: 16 pieces of misinformation spread by the BJP IT cell chief
50,Scheduled,r/india,self.india,13,0,"Random Daily Discussion Thread - April 11, 2020 at 09:15AM"
51,Coronavirus,r/india,indianexpress.com,91,0,"Tamil Nadu cops mistakenly stray into Karnataka, question Home Minister Bommai for lockdown violation"
52,Non-Political,r/india,timesofindia.indiatimes.com,62,0,How the pandemic wiped out oil demand around the world - Times of India
53,Non-Political,r/india,ndtv.com,12,0,What It Looks Like When India's 1.3 Billion People Stay Home
54,Non-Political,r/india,businesstoday.in,166,0,"Indians least active, second most sleep-deprived: Fitbit"
55,Coronavirus,r/india,freepressjournal.in,260,0,Shashi Tharoor slams PM Modi for supplying hydroxychloroquine to Israel; asks what happened to 'India First'
56,Coronavirus,r/india,self.india,315,0,Our University (UoA) donated 44 lakhs to PM-CARES Fund but has not released student stipends and salaries since two months!
57,Coronavirus,r/india,indiatoday.in,8,0,Karnataka BJP MLA celebrates birthday with villagers amid lockdown
58,,r/india,deccanherald.com,131,0,Kannan Gopinathan who quit in August over Jammu and Kashmir told to join duty; he says no way |
59,Coronavirus,r/india,covidsimpact.com,11,0,"Hey people, I’ve made a web application to track COVID-19 globally. There are precautions, helpline all in one place also a chatbot which can help you with the most frequently asked questions on COVID-19. I undertook this project to utilise my time in quarantine. #StaySafe #StayAware"
60,Politics,r/india,theatlantic.com,154,0,How Modi Has Trampled the Founding Idea of India - The Atlantic
61,Policy/Economy,r/india,timesofindia.indiatimes.com,556,0,Haryana doubles salaries of frontline health department staff
62,Coronavirus,r/india,ndtv.com,1032,0,"Telangana Woman Rides 1,400 km On Scooty To Bring Back Son Stranded In Andhra Pradesh"
63,Non-Political,r/india,self.india,65,0,The drumbeats of Apna time aayega song from Gully boy movie seems to be similar to the introduction drumbeat of pornhub. Please pay attention to the drumbeats while listening !
64,Coronavirus,r/india,self.india,11,0,Is Corona virus going to be seasonal flu like h1n1 swine flu ?
65,Politics,r/india,youtube.com,44,0,Best Debate ever - News18
66,Non-Political,r/india,thehansindia.com,5,0,Woman commits suicide as wedding gets cancel over dowry in Visakhapatnam
67,Coronavirus,r/india,bbc.com,7,0,Inside India's busiest Covid-19 hospital
68,Coronavirus,r/india,self.india,7,0,Focus on relaxing lockdown for harvesting in rural India
69,AskIndia,r/india,self.india,6,0,"Has anyone ever used a third party filters (e.g. filtercart) for RO+UV water filters? If so, how was their functional quality."
70,AskIndia,r/india,self.india,9,0,What's your opinion on the multiple song remakes being done by T-Series.?
71,Business/Finance,r/india,self.india,8,0,Banning chinese items?
72,Coronavirus,r/india,ndtv.com,201,0,"WHO Admits Error: ""Cluster Of Cases In India, Not Community Transmission"""
73,Non-Political,r/india,i.redd.it,5,0,Reruns of 1980-90s classics make DD most-watched channel. [OC Meme]
74,Politics,r/india,ndtv.com,53,0,PM Modi Only World Leader In White House's 19-Strong Twitter List
75,Policy/Economy,r/india,thenewsminute.com,4,0,Extension of lockdown till May can put 32 million livelihoods at risk: McKinsey report
76,Coronavirus,r/india,thehindu.com,25,0,Lockdown | Migrant workers in Surat come out on road demanding salaries. More than 1000 persons assembled on street demanding to return to their home States.
77,Business/Finance,r/india,self.india,6,0,"I Would Expect From RBI Is To Issue A Clarification To Set Rest All The Speculation: Sanjay Chameria, VC & MD, Magma Fincorp"
78,Non-Political,r/india,youtu.be,14,0,Surat Migrant Workers on Streets
79,Coronavirus,r/india,ndtv.com,190,0,"Congress Leader Who Hid Delhi Mosque Visit, His Family COVID-19 +ve"
80,AskIndia,r/india,self.india,7,0,In lockdown with a large number of people/family. Mental health/ennui?
81,Coronavirus,r/india,i.redd.it,203,0,"Disinfect the sources of communal virus, will they?"
82,Coronavirus,r/india,ibtimes.co.in,399,0,First lynching over coronavirus; Delhi man killed over Jamaat link
83,Coronavirus,r/india,self.india,18,0,Coronavirus has single handedly defeated all the othes causes of death. Jai Corona
84,Science/Technology,r/india,self.india,4,0,Please report these youtube channels that promote sexual content in disguise and harm our kids.
85,Non-Political,r/india,self.india,3,0,Family TV time content ?
86,Coronavirus,r/india,twitter.com,90,0,Punjab extends lockdown/curfew in the state till May 1st
87,Politics,r/india,self.india,55,0,Indian Media in a NUTSHELL!
88,Coronavirus,r/india,moneycontrol.com,54,0,Yes Bank case | Kapil and Dheeraj Wadhawan detained in Mahabaleshwar for violating Section 144
89,Coronavirus,r/india,bloombergquint.com,26,0,Coronavirus Lockdown: Health Of River Ganga Improves
90,Coronavirus,r/india,news.rediff.com,23,0,"24 of 26 coronavirus patients in Sangli recover, 22 discharged"
91,Coronavirus,r/india,ndtv.com,4,0,"""100 Days Of COVID-19"": Chief Minister Pinarayi Vijayan Shares Kerala's Story"
92,Coronavirus,r/india,foreignpolicy.com,13,0,Modi’s India Isn’t Prepared for the Coronavirus
93,Photography,r/india,i.redd.it,211,0,View of Parvati Valley from Malana Village [OC] [4608x3072]
94,Non-Political,r/india,ndtv.com,15,0,"""Can't Let Anyone Murder Shaktimaan As Ekta Kapoor Murdered Mahabharat"": Mukesh Khanna"
95,Coronavirus,r/india,ndtv.com,274,0,"Coronavirus: IPS Officer Sent On Leave After Mumbai Billionaires Kapil, Dheeraj Wadhawan Violated COVID-19 Lockdown"
96,Non-Political,r/india,i.redd.it,2570,0,We had hail storm in sikkim today.
97,Politics,r/india,theprint.in,91,0,"Sonia Gandhi wants Modi to suspend Central Vista. But this urban harakiri must be scrapped: Modi's Rs 20,000 crore worth Central Vista revamp project goes against the cardinal objective of Delhi Master Plan 2021 to decentralise government offices."
98,Non-Political,r/india,twitter.com,28,0,Namaaz in times of Corona
99,Coronavirus,r/india,thewire.in,16,0,Centre's 'More Than Enough' Assurance Rings Hollow as India Feels Hydroxychloroquine Crunch
100,Politics,r/india,ndtv.com,34,0,"IAS Officer Kannan Gopinathan Who Quit Over J&K Asked To Join Duty Amid COVID-19, Refuses"
101,Politics,r/india,i.redd.it,53,0,PRESS RELEASE ON MISLEADING MEDIA REPORTS - Ministry of Railways
102,Coronavirus,r/india,livelaw.in,19,0,[NP]Live Streaming Of Hearing During COVID 19: Kerala HC And Justice Gautam Patel Of Bombay HC Lead The Way
103,Politics,r/india,scroll.in,277,0,Why the slow drip of anti-Muslim poison in India is now a flood
104,Coronavirus,r/india,news18.com,3,0,"Sarpanch Leads Namaz in Madhya Pradesh Mosque Amid Lockdown, Held With 40 Others"
105,Non-Political,r/india,jantakareporter.com,494,0,"Indian man from Karnataka sacked for insulting Islam, issues apology amidst likely arrest by Dubai Police"
106,Science/Technology,r/india,self.india,2,0,"Amongst fucked up remakes, I made a Spotify playlist of really good bollywood songs that'll make your day!"
107,Non-Political,r/india,timesnownews.com,204,0,"23 members of DHFL-defaulter Wadhawan family violate lockdown, drive 6 hours from Mumbai to ‘chill’ in Mahabaleshwar"
108,Non-Political,r/india,theprint.in,78,0,"In lockdown, 10 killed by lightning strikes in separate incidents in Andhra"
109,Politics,r/india,m.timesofindia.com,4,0,Village sarpanch slams Sonia Gandhi for giving credit of Bhilwara's Covid-19 model to Rahul Gandhi
110,Photography,r/india,i.redd.it,2,0,"""Sunset"" [1232x1840] Shot on Fujifilm Proplus ISO 200 35mm film using Canon EOS 300 film camera."
111,Politics,r/india,ibtimes.co.in,8,0,"PM Modi tweets on remembering Christ this Good Friday, recalls his courage and righteousness"
112,Politics,r/india,self.india,54,0,Madhya Pradesh : CM Shivraj Chouhan transfers Rs. 700 crore earmarked for IIFA-2020 to CM's relief fund
113,Coronavirus,r/india,self.india,13,0,When will it be normal again?
114,AskIndia,r/india,self.india,51,0,Will lockdown extend even after 14th April? Will transport remain suspended?
115,Coronavirus,r/india,thehindu.com,12,0,Lockdown | Migrant workers come out on road demanding salaries
116,Coronavirus,r/india,indiatoday.in,36,0,"Delhi: Man snatches senior citizen's vegetables, beats him to death"
117,AskIndia,r/india,self.india,5,0,How likely is the Ahmedabad airport to open on April 14th?
118,Coronavirus,r/india,timesofindia.indiatimes.com,296,0,Drug sent to US unavailable for BMC doctors | Mumbai News
119,AskIndia,r/india,self.india,8,0,How does india produces so much milk?
120,Coronavirus,r/india,m.economictimes.com,34,0,"Congress leader with Covid-19 booked for hiding travel history, village declared containment zone"
121,Policy/Economy,r/india,dilkabab.wordpress.com,2,0,The Indian Food Security Crisis in 1960s And The Symphony Orchestra That Solved it
122,Coronavirus,r/india,i.redd.it,77,0,"COVID, Go ask malaria how lethal he is...!"
123,Coronavirus,r/india,livemint.com,27,0,"Covid-19: In wake of SC order, private labs urge govt to reimburse testing costs"
124,Coronavirus,r/india,indiatoday.in,36,0,AIIMS Resident Doctors' Association rejects mandatory donation of 1-day salary to PM-CARES fund
125,Politics,r/india,twitter.com,28,0,"India carries out precision targeting of gun areas, terrorist launch pads and ammunition in response to unprovoked ceasefire violation by Pakistan in Keran Sector of Kupwara district. Reports of heavy damage on enemy side: Defence Spokesperson, Srinagar #JammuandKashmir"
126,Coronavirus,r/india,gulfnews.com,2,0,COVID-19: Why have India and Pakistan abandoned their citizens in the UAE? | Editorials – Gulf News
127,Scheduled,r/india,self.india,29,0,Late Night Random Discussion Thread !
128,Coronavirus,r/india,thehindu.com,168,0,SBI employees shut branch claiming all were infected
129,,r/india,frontline.thehindu.com,19,0,Kashmir’s wait for 4G Internet service set to get longer
130,Non-Political,r/india,ndtv.com,100,0,Biker Drags Mumbai Cop For 50 Metres To Escape Checking During Lockdown
131,Coronavirus,r/india,ndtv.com,17,0,"DHFL Promoters' Lockdown Vacation In 5 Luxury Cars, High Walled Farmhouse"
132,Non-Political,r/india,youtube.com,32,0,Siddis: In It For The Long Run | Unique Stories from India
133,Coronavirus,r/india,boomlive.in,91,0,Why Mumbai Nurses Testing Positive For COVID-19 Is A Cause For Worry | Over 50 nurses in two private medical hospitals test positive after patients with no symptoms test positive for COVID-19 eventually.
134,AskIndia,r/india,self.india,35,0,"With liquor shops around the country shut, have *most* Indians given up drinking during lockdown?"
135,Politics,r/india,theprint.in,97,0,"Relief camp shut, no home to return to, Delhi's riot victims shelter with do-gooders"
136,Non-Political,r/india,video.vice.com,108,0,Forced To Marry: Teenage Girls in Bordertown Malda
137,Coronavirus,r/india,theprint.in,177,0,"After HCQ, countries begin to call India for the humble pain and fever tablet paracetamol"
138,Politics,r/india,ndtv.com,21,0,"Heavy Shelling Along Line Of Control As Pakistan Violates Ceasefire, Indian Army Retaliates"
139,AskIndia,r/india,self.india,37,0,India needs to stand up against such people indulging in animal cruelty
140,Non-Political,r/india,thequint.com,1,0,"Parents of Army Hero Forced to Drive 2,000 km for His Last Rites"
141,,r/india,i.redd.it,1,0,Just a normal Indian meme
142,Coronavirus,r/india,twitter.com,1,0,#BREAKING – Shipments of serological test kits have not arrived in India yet. At least 5 deadlines have been missed. We have no option but to do RT PCR tests in clusters instead of rapid testing: ICMR Sources.
143,Coronavirus,r/india,i.redd.it,1,0,The importance of testing - Capital leads the way!
144,Coronavirus,r/india,twitter.com,57,0,"""This is to clarify that Arunachal Pradesh has got only 1 COVID-19 positive case till date. The reporting by Zeenews is false and does not carry any authenticity"""
145,Policy/Economy,r/india,self.india,64,0,"The need to investigate the NSO Group, which was behind the Pegasus software, is now more than ever."
146,Non-Political,r/india,ndtv.com,12,0,"Days After Deadly Encounter, India Targets Pak Ammo Dump, Releases Video"
147,AskIndia,r/india,self.india,15,0,Why was India a close ally of the Soviet Union?
148,Coronavirus,r/india,i.redd.it,72,0,Coronavirus Tests per Million
149,AskIndia,r/india,self.india,1,0,Why do birth residence of India refer to Rani of Jhansi as a man and not as a woman?
150,Coronavirus,r/india,npr.org,5,0,"With Coronavirus Lockdown, India's Cities See Clear Blue Skies As Air Pollution Drops"
151,Coronavirus,r/india,livelaw.in,14,0,Undertake Intensive Search Operations To Locate The Persons Who Have Returned From Tablighi Jamaat: Chhattisgarh HC Tells State [Read Order]
152,Coronavirus,r/india,financialexpress.com,28,0,Madhya Pradesh: 40 booked for gathering at Chhindwara mosque despite lockdown
153,Coronavirus,r/india,thenewsminute.com,82,0,"TTD and other temple guest houses in Andhra turned into quarantine centres. | Guesthouses of the Tirumala temple, and Srikalahasti and Kanipakam temples, are being used to quarantine people awaiting their test results."
154,Politics,r/india,wsws.org,16,0,"Modi signals India’s calamitous 21-day lockdown to be extended, as coronavirus cases surge"
155,AskIndia,r/india,self.india,1,0,"College interview tips, please?"
156,Coronavirus,r/india,science.thewire.in,38,0,"ICMR Revises Strategy, Will Test People Having Influenza-Like Symptoms From Coronavirus Hotspots"
157,Politics,r/india,self.india,21,0,What do you guys know about girish nanavati and akshay mehta that is not in mainstream media??
158,AskIndia,r/india,self.india,44,0,I'm always unmotivated: Need advice and help
159,Politics,r/india,nationalinterest.org,9,0,India Isn't Fooled By China's Coronavirus Charm Offensive
160,Coronavirus,r/india,news18.com,24,0,"A Bigger Crisis in MP? 18 Health Dept Officers Test Positive for Covid-19, Several Others in Quarantine"
161,Coronavirus,r/india,mumbaimirror.indiatimes.com,3,0,"After trader tests positive, Mumbai APMC to shut down"
162,AskIndia,r/india,self.india,18,0,Effects of an extended lockdown?
163,AskIndia,r/india,self.india,49,0,The job loss/placement loss post
164,,r/india,businessinsider.in,24,0,A group of Indian veterans raise ₹300 crore to build a B-school where chief executives will teach |
165,Coronavirus,r/india,ndtv.com,9,0,Indore Doctor With No Travel Or Contact History Dies Of Coronavirus
166,Policy/Economy,r/india,wap.business-standard.com,47,0,RBI admits GDP forecasts prior to coronavirus outbreak were off the mark
167,Coronavirus,r/india,thehindu.com,58,0,32 officials infected as coronavirus hits Madhya Pradesh Health Department
168,Politics,r/india,livefistdefence.com,14,0,Drone Films Indian Artillery Pounding Pak Army In Keran Today
169,Politics,r/india,thewire.in,17,0,How Will Modi and the Chief Ministers Get Us Out of the Coronavirus Chakravyuh?
170,Non-Political,r/india,accuweather.com,21,0,The first heatwave of 2020 to grip India as nationwide lockdown persists
171,Coronavirus,r/india,timesofindia.indiatimes.com,56,0,"No masks, no sanitisers for community health workers"
172,Coronavirus,r/india,orissapost.com,32,0,"Government helpline receives 92,000 calls in 11 days for child abuse and violence"
173,Non-Political,r/india,self.india,5,0,I need some help.
174,Non-Political,r/india,youtu.be,12,0,My Daily Life in the SLUMS OF MUMBAI (Life-Changing 5 Days)
175,Policy/Economy,r/india,economictimes.indiatimes.com,15,0,99.8% workforce in IT sector incapable of remote working: Study
176,Non-Political,r/india,twitter.com,17,0,Delhi Government set up Sanitization Tunnel in Azadpur Mandi ..
177,AskIndia,r/india,self.india,5,0,"Folks who have lost their jobs (or will), how are you coping?"
178,Non-Political,r/india,self.india,10,0,Localized SubReddit for Odisha
179,Non-Political,r/india,bloomberg.com,8,0,What It Looks Like When 1.3 Billion People Stay Home
180,AskIndia,r/india,self.india,28,0,Why do we only question our celebrities and not the political leaders?
181,Coronavirus,r/india,ndtv.com,33,0,"Congress Leader Who Hid Delhi Mosque Visit, His Family COVID-19 +ve"
182,Politics,r/india,theprint.in,12,0,"Lockdown may contain Covid-19, but it can’t curb the virus of Islamophobia in India"
183,AskIndia,r/india,self.india,13,0,Understanding the RBI's MORATORIUM on cards and EMI's Payment.
184,Coronavirus,r/india,thequint.com,11,0,"Covid19: 886 cases in 24 hours,total cases rise to 6761"
185,Coronavirus,r/india,self.india,40,0,"We are a team of independent psychologists based in Hyderabad, providing free supportive services for mental health during this pandemic. Reach out to us. You are not alone."
186,Coronavirus,r/india,theverge.com,6,0,Apple and Google are building a coronavirus tracking system into iOS and Android
187,Business/Finance,r/india,techcrunch.com,15,0,"Startups, VCs in India request ‘relief package’ from the government to fight coronavirus disruption"
188,Coronavirus,r/india,fit.thequint.com,8,0,Don’t Abandon Your Pets! No Link That Animals Transfer COVID-19
189,Coronavirus,r/india,i.redd.it,276,0,"Brilliant cartoon from BBC Hindi on ""Some cities have made it mandatory to wear masks""."
190,Politics,r/india,hrw.org,3,0,Discrimination Against Muslims under India’s New Citizenship Policy | Human Rights Watch (HRW.org) [xpost r/Longreads]
191,Coronavirus,r/india,business-standard.com,12,0,Bhilwara model: How this Rajasthan district brought Covid-19 under control
192,Coronavirus,r/india,self.india,10,0,Latest Indian Innovations and Funding Opportunities to Combat COVID-19
193,Non-Political,r/india,self.india,26,0,Spam calls!
194,Coronavirus,r/india,self.india,7,0,Bengaluru friends how are you going back home?
195,Sports,r/india,cnbctv18.com,7,0,"IPL 2020 may be held in July, 'minus crowds if needed'"
196,Coronavirus,r/india,frontline.thehindu.com,13,0,"Test not, find not: The government’s failure to detect, trace and isolate infected persons in the nearly two-month-long window of opportunity it had to protect people from the coronavirus shows its irresponsible handling of the COVID-19 crisis"
197,AskIndia,r/india,self.india,13,0,Why Kaspersky Total security is way cheaper on Amazon or flipkart as compared to its online site?
198,Coronavirus,r/india,self.india,41,0,"If agriculture not declared an essential service, will India starve due to lock down?"
199,Coronavirus,r/india,telegraphindia.com,13,0,Coronavirus hate campaign triggers attacks
200,Politics,r/india,thequint.com,10,0,India-Japan Ties Can Help Develop Techs for Post-COVID World: PM
201,Coronavirus,r/india,ndtv.com,30,0,"Nearly A Third Of Bihar's COVID-19 Cases From One Family (21 positive cases) | The cluster, one of the biggest in the state, has prompted the government to take stringent measures. Forty-three villages in 10 blocks of the districts have been sealed."
202,Coronavirus,r/india,scroll.in,50,0,Middle-class entitlement is hurting India’s fight against Covid-19
203,Coronavirus,r/india,youtu.be,2,0,TED interview on How the coronavirus is impacting India.
204,Photography,r/india,i.redd.it,3,0,IG ART Joaquin phoenix (it's really difficult to draw on insta stories)
205,Non-Political,r/india,i.imgur.com,513,0,"Bored in lockdown, so made an old monk beer can 😂"
206,Coronavirus,r/india,youtu.be,0,0,India vs Pakistan COVID 19 cases comparison
207,Coronavirus,r/india,bbc.com,9,0,Coronavirus: Inside India's busiest Covid-19 hospital - BBC News
208,Coronavirus,r/india,theprint.in,7,0,"What if coronavirus crisis had hit India under Manmohan Singh, not Modi"
209,Coronavirus,r/india,m.hindustantimes.com,61,0,DHFL scam accused received Maharashtra home department’s nod to travel amid lockdown
